video_id,title,country_code,publishedAt,channelId,channelTitle,categoryId,trending_date,tags,view_count,likes,dislikes,comment_count,thumbnail_link,comments_disabled,ratings_disabled,description
JcFnIgfBmro,Magnitude 6.9 na lindol tumama sa Mindanao | News Patrol,PH,2019-12-15T08:39:18.000Z,UCE2606prvXQc_noEqKxVJXA,ABS-CBN News,25,19.17.12,ABS-CBN|ABS-CBN News|ABS-CBN Philippines|Philippine News|News|Philippines|Headlines|Balita|PH News|Latest News|Latest Balita|Tagalog News|Latest Report|News Report|Breaking News|Current Affairs|ABS-CBN News Channel|ANC News|ANC|ANC Top|ANC24/7|20191215news|December 15 2019|YT0psClarisse PatrolPH|Tagalog news|mindanao earthquake december 15 2019|latest update earthquake in mindanao|earthquake|lindol 2019|Magnitude 6.9|aftershocks|Phivolcs,302134,2860,114,486,https://i.ytimg.com/vi/JcFnIgfBmro/default.jpg,FALSE,FALSE,"#NewsPatrol Niyanig ng magnitude 6.9 na lindol ang Mindanao ngayong hapon. May mga naitala na ring aftershocks ang Phivolcs. To watch more breaking news videos click the link below:https://www.youtube.com/playlist?list=PLgyY1WylJUmjQauL5PxcIPdeiOAxDsjJ0Check out what's trending on the internet! Click the link below:https://www.youtube.com/watch?v=GrXNmNs--A0&list=PLgyY1WylJUmiNASnHYchkIZsdUYgT_TQXFor more ANC videos, click the link below:https://www.youtube.com/playlist?list=PLgyY1WylJUmjOzwgTLUbxPfMSBlMRBE9sSubscribe to ANC YouTube channel! Click here: http://bit.ly/ANC24-7Visit our website at https://news.abs-cbn.com/ancFacebook: https://www.facebook.com/ancalertsTwitter: https://twitter.com/ancalerts#ABSCBNNews #NewsPatrol#News"
pmI_xlxuIag,"NEW Tagalog Reggae Classics Songs 2019 - Chocolate Factory ,Tropical Depression, Blakdyak",PH,2019-12-14T22:00:04.000Z,UCk7n8c78wYziJ4g3wjfJsHA,Reggae Hits Pinoy,22,19.17.12,Reggae Music Hits Ever|Reggae Classic|best reggae music|best reggae music songs|reggae music 2019|best reggae of all time|reggae love songs|Bob Marley|bob marley r|Tropical Depression Reggea Songs|tropical depression 2018|tropical depression album|tropical depression tagalog|Kapayapaan|Bilog Na Naman Ang Buwan|Do The Reggae|Mahal Kita|Biyaheng Langit|Baleleng|Chocolate Factory|Tropical Depression|Blakdyak,140547,1001,96,27,https://i.ytimg.com/vi/pmI_xlxuIag/default.jpg,FALSE,FALSE,"NEW Tagalog Reggae Classics Songs 2019 - Chocolate Factory ,Tropical Depression, BlakdyakThanks for watching! Don't forget to SUBCRIBE, Like & Share my video if you enjoy it! Have a nice day!© Follow Collection Love SongsYoutube → https://bit.ly/2XeS5lPTagalog Reggae Playlist : https://bitlylink.com/31ZMK🚫 If you have any problem with copyright issues, please CONTACT US DIRECTLY before doing anything, or question please write to me in email"
2H49n2_oDzI,12 Christmas Sibling Pranks! Sister vs Brother Prank Wars!,PH,2019-12-12T20:00:00.000Z,UCWwqHwqLSrdWMgp5DZG5Dzg,Troom Troom,26,19.17.12,Christmas|Christmas Pranks|Xmas|Sister vs Brother|Christmas Sibling Pranks|Sibling Pranks|Prank|Pranks|Sister vs Brother Pranks|Prank Wars|Brother Pranks|Sister Pranks|Funny Christmas|Christmas Prank Ideas|Xmas Pranks|How to Prank|How to Prank Brother|How to Prank Sister|Troom troom,2252228,20855,2015,707,https://i.ytimg.com/vi/2H49n2_oDzI/default.jpg,FALSE,FALSE,"Subscribe Here: https://www.youtube.com/channel/UCWwqHwqLSrdWMgp5DZG5Dzg?sub_confirmation=110 DIY Unicorn School Supplies vs Mermaid School Supplies: https://youtu.be/lFy7jqk8Q_o?list=PLy0LaulZe0vSzNLVwlQZVJszbLCsIwl_CChristmas is no reason to stop prank wars! Quite the contrary - this is a great time to arrange a couple of thematic pranks for your beloved brother or sister! Do you think so too? Then you will definitely like our new Christmas prank ideas!Supplies and tools:• Empty EOS container• Ribbon• Food coloring• Syringe• Marshmallows• Tangerine• Utility knife• Garlic• Pads• Decorative paper• Double-sided tape• Bows• Balloon• Scissors• Cardboard tube• Hot glue gun• Tape• Cookie dough• Spicy curry• Garlic powder• Cookie cutter• Gold edible pearl dust• Chocolate Santa Claus• Carrot• Chili ketchup• Cardboard• Pencil• Ruler• Elastic ribbon• Toy• ConfettiWatch More Troom Troom: Popular Videos:14 Weird Ways To Sneak Food Into Class / Back To School Pranks:  https://youtu.be/W5p2ndS34vA18 Funny Pranks! Prank Wars! https://youtu.be/yWazGzCNtJ411 DIY Edible Makeup Ideas/11 Funny Pranks:  https://youtu.be/kewz3hF63Xo17 Weird Ways To Sneak Makeup Into Class:  https://youtu.be/bvhBIsmzhwEGummy Food vs Real Food Challenge!  https://youtu.be/jBIG6GsQcq8Popular Playlists:Funny Pranks: https://www.youtube.com/playlist?list=PLy0LaulZe0vRyRDcwVaqbvnbSqhSQNtS-Back to School: https://www.youtube.com/playlist?list=PLy0LaulZe0vSzNLVwlQZVJszbLCsIwl_CLife Hacks: https://www.youtube.com/playlist?list=PLy0LaulZe0vSljAapkasaxsIKJp7I-7j0Beauty And Makeup Hacks: https://www.youtube.com/playlist?list=PLy0LaulZe0vSUQifjokDaw5m9aIgOQKt-Home Décor: https://www.youtube.com/playlist?list=PLy0LaulZe0vRWdxuF7xEwK_eJV2cZ8dt0Follow Troom Troom:Subscribe: https://www.youtube.com/channel/UCWwqHwqLSrdWMgp5DZG5Dzg?sub_confirmation=1Instagram: https://www.instagram.com/troomtroom/Facebook: https://www.facebook.com/troomhandsPinterest: https://pinterest.com/troomtroom/Troom Troom Español: Subscribe: https://www.youtube.com/channel/UCu6oyJJ6PlkeNNv6n26ZNyA?sub_confirmation=1Troom Troom Française:Subscribe: https://www.youtube.com/channel/UCyNeKmBHI10u4bwYEKimlZA?sub_confirmation=1Troom Troom Russian: Subscribe: https://www.youtube.com/channel/UCq1JpGFxcZTbbOAz010U-og?sub_confirmation=1Troom Troom Deutsch:Subscribe:  https://www.youtube.com/channel/UCzgmxZIlgfH1fgch7OpigIA?sub_confirmation=1Troom Troom Chinese:Subscribe:  https://www.youtube.com/channel/UCV3NWBs2K7pOEGmI4w_2dhg?sub_confirmation=1Troom Troom Português:Subscribe: https://www.youtube.com/channel/UCgCQlMYN2XypwYC2wcR32bA?sub_confirmation=1Troom Troom Japanese:Subscribe: https://www.youtube.com/channel/UCPCwT9JMWPjg6xAWrQxhQaw?sub_confirmation=1About Troom Troom: Easy DIY how to video tutorials. DIY Accessories, Scrapbooking Cards, Home Décor, Make Up Tutorials, Life Hacks, and MUCH more! Make it easy! For any business enquires please contact me at: troomtroomdiy@gmail.comQuestion of the Day: did you like our Christmas pranks? Comment Below!Don’t forget to turn on notifications, like, & subscribe!"
6SqmQq9bE5s,NAG-DATE SA LUNETA ANG GOLD SQUAD | The Gold Squad,PH,2019-12-13T10:00:14.000Z,UCMZ343FCzDO3mfX9VERi_PQ,The Gold Squad,24,19.17.12,The Gold Squad|ABS-CBN|ABS-CBN Show|Star Magic|Artists|Filipino Artists|Seth Fedelin|Francine Diaz|Kyles Echarri|Andrea Brillantes|Seth|Francine|Kyle|Andrea|Kadenang Ginto|Kadenang Ginto Stars|20191213TheGoldSquad|December 13 2019|YT0psBea|Squadmates|TGS|TGS vlog|luneta|park|luneta park|tgs luneta park|the gold squad luneta date|sethdrea|kycine|seth and andrea|kyle and francine|luneta park hopping|tourist spots|manila tourist attractions|luneta park date,368177,16192,151,1615,https://i.ytimg.com/vi/6SqmQq9bE5s/default.jpg,FALSE,FALSE,"Still the best place to spend time walking and picture taking - LUNETA! Andrea, Francine, Seth, and Kyle took time to bond and meet some of their fans with a walking tour of Manila’s pride Luneta Park.Subscribe to The Gold Squad channel! - http://bit.ly/TheGoldSquadVisit our official website! http://entertainment.abs-cbn.comhttp://www.push.com.phWatch the full episodes of Kadenang Ginto on TFC.TV:http://bit.ly/KadenangGinto-TFCTVand on iWant for Philippine viewers:http://bit.ly/KadenangGinto-iWantFacebook: http://www.facebook.com/DreamscapePHTwitter: https://twitter.com/DreamscapePHInstagram: https://www.instagram.com/dreamscapeph#TheGoldSquad#LunetaPark#Squadmates"
R4K6S8b_7gc,May Pag-asang Magsama sa Kentucky si Kai Sotto at Jalen Green! | Dapat Abangan ng mga Pinoy!,PH,2019-12-15T03:56:01.000Z,UC4qj7Lhd2SP1hWjzdypeplw,The Bro TV,17,19.17.12,[none],188400,2445,73,172,https://i.ytimg.com/vi/R4K6S8b_7gc/default.jpg,FALSE,FALSE,"Hey what's up mga bro welcome na welcome ka sa ating channel!Business purposes you can email me: @thebrotv2017@gmail.comMusic by Retnik Beats: (https://www.youtube/c/retnikbeatsbe/)Background Music by NEFFEX: (https://www.youtube.com/user/neffexmusic)This video is edited under by Fair use law of YouTube.Credits to ESPN 5, FIBA, PBA, NBA, ABL, ABS-CBN Sports and other respectful owners of the images and videos that has been used in this video"
GdxciZzxJQQ,14 Types of Students After School,PH,2019-12-15T13:00:02.000Z,UCGwcH4qnJ2qM_ZJUSFcAMAA,JianHao Tan,23,19.17.12,jianhao tan|jian hao tan|jianhao|the jianhao tan|thejianhaotan|jian hao|jianhaotan|kim lee|singapore|singaporean|youtuber|youtubers|youtube|exam|exams|students|afterschool|after|school|types of students|denise|vincent|fight|terry|class|t1t5|movie|trailer|results|mom|sylvia|nicole|i8|car|phone|photos|before|noc|bullies|bully|juhi|tik tok|activities|swimming|class room|room|during|confront,1541057,59759,1158,10009,https://i.ytimg.com/vi/GdxciZzxJQQ/default.jpg,FALSE,FALSE,"School's out! What do students do after school?Follow me on Instagram: http://www.instagram.com/thejianhaotanFeaturing:Debbie: https://www.instagram.com/debbwie/ Denise: https://www.instagram.com/denisesoongeelyn/ PeiShi: https://www.instagram.com/speishi/Naomi: https://www.instagram.com/naomineo_/Ren Yi Xiang: https://www.instagram.com/ren.yi.xiang  Vincent: https://www.instagram.com/itsvincentsin/  Nicole: https://www.instagram.com/nicolekittykatx/  Trevmonki: https://www.instagram.com/trevtham/  Jasmine: https://www.instagram.com/jasminelhr/  Danial Ron: https://www.instagram.com/Danialron/ Vicky: https://www.instagram.com/yklvv/  Hakim: https://www.instagram.com/runawaykim/  Kevin: https://www.instagram.com/kaleidoscovin/ Abbey: https://www.instagram.com/abbeypuppey/ Juhi: https://www.instagram.com/juhinars/ Bella: https://www.instagram.com/bellazade/ Tasha: https://www.instagram.com/tashh6/  Julynn: https://www.instagram.com/julynnlau/  Leonard: https://www.instagram.com/leonardlyy/ Miss Sherly: https://www.instagram.com/lyzpopz/ Dee Kosh: https://www.instagram.com/deekosh/ Eliza: https://www.instagram.com/eliza.maryesther/ Darrel: https://www.instagram.com/darrelkicksass/Melvinder: https://www.instagram.com/melvinthesingh/ NOCSylvia: https://www.instagram.com/sylsylnoc/Isabelle: https://www.instagram.com/bombiibii/ Julian: https://www.instagram.com/juliantaytm/ Joanna: https://www.instagram.com/joannalhs/ Sherri: https://www.instagram.com/sherriashlee/ Das: https://www.instagram.com/dasdyl/Grace: https://www.instagram.com/gracelsyy/For business enquiries, contact business@thejianhaotan.com directlyGet your ClassT1T5 merch now: https://teamtitanstore.com/collections/all/t1t5 TITAN DIGITAL MEDIA: http://www.titandigitalmedia.com"
cNNXWOENH8k,"Hurados, inaliw ang Madlang People sa kanilang sariling version ng Gummy Bearxx",PH,2019-12-16T10:45:46.000Z,UCjz5Ai3RBvw-vdhii-AE45g,Kapamilya Trending,24,19.17.12,Kapamilya Trending|Kapamilya Trending Showtime|Kapamilya Trending Sampu-Sample|ABS-CBN Online|ABS-CBN Philippines|Philippines|Entertainment|ABS-CBN Entertainment|Showbiz|Its Showtime|Kapamilya Entertainment|Kapamilya Shows 2019|Its Showtime Highlights|Its Showtime December 16 2019|#KapamilyaTrending|#ItsShowtime|gummy bear song|kyla gummy bear song|tnt hurado gummy bear song|its showtime gummy bear|yeng gummy bear|December 16 2019|20191216online|YT0psJohnelle,578038,11577,157,509,https://i.ytimg.com/vi/cNNXWOENH8k/default.jpg,FALSE,FALSE,"Dulce, Kyla, Louie Ocampo, Yeng Constantino, Ogie Alcasid and Vice Ganda deliver their unique renditions of The Gummy Bear Song.Subscribe now: https://www.youtube.com/channel/UCjz5Ai3RBvw-vdhii-AE45g#ItsShowtime#GummyBearSong#KapamilyaTrending"
VRWSAuzM0jI,Tones and I - Dance Monkey (Lyrics),PH,2019-12-11T19:58:19.000Z,UCn7Z0uhzGS1KjnO-sWml_dw,Unique Vibes,10,19.17.12,Unique Vibes|Music|pop|lyrics|indie|vibes|pop music|new pop|dance|new music friday|tones and i|dance monkey|tones and i dance monkey|dance monkey tones and i|dance monkey lyrics|tones and i lyrics|tones and i dance monkey lyrics|dane monkey lyrics tones and i|lyrics dance monkey|dance for me|dance for me dance for me|dance for me oh oh|and i say dance for me|dance for me lyrics|tik tok dance for me|dance for me tik tok|tones and i lyrics dance monkey,12323389,251101,7960,7632,https://i.ytimg.com/vi/VRWSAuzM0jI/default.jpg,FALSE,FALSE,"Stream Tones and I - Dance Monkey (Lyrics): https://spoti.fi/2LrpDX7✖ BEST MUSIC ON SPOTIFY: https://spoti.fi/2LrpDX7✖ FOLLOW MY AWESOME INSTAGRAM: https://instagram.com/unique_vibes_official/► CONNECT WITH UNIQUE VIBESSubscribe: https://youtube.com/c/UniqueVibesMusicSpotify: https://spoti.fi/2LrpDX7Instagram: https://instagram.com/unique_vibes_official/Discord Server: https://discord.gg/VSHcHZ8Twitter: https://twitter.com/uniquevbsSoundcloud: https://soundcloud.com/unique_vibes-----------------------------------------------------------------------------------------------Get Tones and I - Dance Monkey (Lyrics): https://tonesandi.lnk.to/DanceMonkeyYT► Tones and Ihttps://www.tonesandi.comhttps://www.instagram.com/tonesandihttps://twitter.com/tonesandimusicThey say Oh my god I see the way you shineTake your hand, my dear, and place them both in mineYou know you stopped me dead when I was passing byAnd now I beg to see you dance just one more timeOoh I see you, see you, see you every timeAnd oh my I, I like your styleYou, you make me, make me, make me wanna cryAnd now I beg to see you dance just one more timeSo I sayDance for me, dance for me, dance for me oh oh ohI've never seen anybody do the things you do beforeThey say move for me, move for me, move for me ay ay ayAnd when you're done I'll make you do it all againI said oh my god I see you walking byTake my hands, my dear, and look me in my eyesJust like a monkey I've been dancing my whole lifeBut you just beg to see me dance just one more timeOoh I see you, see you, see you every timeAnd oh my I, I like your styleYou, you make me, make me, make me wanna cryAnd now I beg to see you dance just one more timeSo I sayDance for me, dance for me, dance for me oh oh ohI've never seen anybody do the things you do beforeThey say move for me, move for me, move for me ay ay ayAnd when you're done I'll make you do it all againThey sayDance for me, dance for me, dance for me oh oh oh, oh oh, oh ohI've never seen anybody do the things you do beforeThey say move for me, move for me, move for me ay ay ayAnd when you're done I'll make you do it all againOoh (All again, all again)Woah-oh, woah-oh, ohOoh (All again, all again)Ah ah, ah ah, ayThey sayDance for me, dance for me, dance for me oh oh ohI've never seen anybody do the things you do beforeThey say move for me, move for me, move for me ay ay ayAnd when you're done I'll make you do it all againThey sayDance for me, dance for me, dance for me oh oh oh, oh oh, oh ohI've never seen anybody do the things you do beforeThey say move for me, move for me, move for me ay ay ayAnd when you're done I'll make you do it all againAll againWallpaper: unsplash.comI don't own the music in this video. Please contact the artist/label if you want to use it.If you need a song removed from my channel, please contact me here: hello@uniquevbs.com#tonesandi #dancemonkey #dancemonkeylyrics #uniquevibes"
HNJ9eDVNqQ0,Wild Little Love Special Preview | iWant Original Movie,PH,2019-12-07T10:00:03.000Z,UCBShlKe5s0Z04tDm4-gXDeg,iWant,24,19.17.12,ABS-CBN|ABS-CBN Online|Philippines|Philippine Entertainment|ABS-CBN Philippines|iWant|IWANT PH|Full Episodes|Video On Demand|Wild Little Love|Kadenang Ginto|Teen Romance|iWant Original Movie|Benedict Mique|Andrea Brillantes|Seth Fedelin|Carmina Villaroel|Sam and Jake Wild Little Love|iWant Romantic Comedy Movies|Wild Little Love Movie Trailer|Wild Little Love iWant Original Movie|The Gold squad|squadmates|Sethdrea|December 7 2019|20191207iwant|YT0psFaye,1834346,33044,937,1061,https://i.ytimg.com/vi/HNJ9eDVNqQ0/default.jpg,FALSE,FALSE,Wild rich girl meets poor chick boy. Can their love survive in this wild little world? Stream the full movie for FREE on iWant!Click here to watch the full movie on iWant:  http://bit.ly/37F0WBQSubscribe to iWant YouTube Channel now! - http://bit.ly/iWantYouTubeFollow us on our Social Media accounts:https://www.facebook.com/iWanthttps://twitter.com/iwanthttps://www.instagram.com/iwantofficial#WildLittleLove#iWantOriginalMovie#NASAiWantYAN
o2020hRIBgk,Huli si kuya nanunuod ng IVANA ALAWI ! HAHAHA! (Ivana Alawi Fails),PH,2019-12-17T11:10:38.000Z,UC0trTJPuBqkppbEcF_6xFtA,Claro the Third,24,19.17.12,vlog|blog|pinoy|filipino|trending|trend|viral|viral video|pinay|it's showtime|mayward|maymay|kathniel|ivana|ivana alawi|ivana alawis|ivanaalawi|ivana alawi video|ivana alawi interview|ivana alawi twba|claro|claro saplala|claro the third|fail|fails|clato the third fails|sea games|seagames|miss universe|miss world 2019|miss world 2020,107310,6465,114,1168,https://i.ytimg.com/vi/o2020hRIBgk/default.jpg,FALSE,FALSE,"Sali ka na sa #TeamThirdie. Subscribe na! http://bit.ly/ClaroTheThirdTWITTER - https://twitter.com/clarothethirdINSTAGRAM - https://www.instagram.com/clarothethird/FACEBOOK - www.facebook.com/TeamThirdie"
jWj2LknaD9w,REGALO SAKIN?,PH,2019-12-12T10:41:19.000Z,UC2LB3AyQ4q2rAk5x1HDDT0g,Akosi Dogie,22,19.17.12,[none],528698,16065,379,1587,https://i.ytimg.com/vi/jWj2LknaD9w/default.jpg,FALSE,FALSE,
LnM1kK8iw50,"Rey Boom-Boom Bautista, MINADALI nga bang sumunod sa yapak ni PACQUIAO?",PH,2019-12-15T12:14:04.000Z,UC0CNrRVlOB9hxz9AhnUYKrA,PINOY BOXING PRODIGY,17,19.17.12,Rey Boom-Boom Bautista MINADALI nga bang sumunod sa yapak ni PACQUIAO?,103485,1216,59,235,https://i.ytimg.com/vi/LnM1kK8iw50/default.jpg,FALSE,FALSE,
xbPistLtDMc,Ang Pag PASLANG sa Mandarayang Kalaban ni Manny Pacquiao,PH,2019-12-11T23:33:49.000Z,UC7y9AlpOWUk8fBbzo8oL3Sg,Walang Preno TV,17,19.17.12,Ang Pag PASLANG sa Mandarayang Kalaban ni Manny Pacquiao|Agapito Sanchez vs Manny Pacquiao Highlights|Agapito El Cyclone Sanchez|Agapito Sanchez El Cylone Life|Manny Pacquiaos Toughest Fight|Agapito Sanchez walang preno tv|Manny Pacquiao Agapito Sanchez Walang preno tv|The Life Story of Agapito El Cyclone Sanchez|El Siclon Agapito Sanchez,660777,5467,333,330,https://i.ytimg.com/vi/xbPistLtDMc/default.jpg,FALSE,FALSE,"Ang Pag PASLANG sa Mandarayang Kalaban ni Manny Pacquiao DISCLAIMER - No copyright infringement is intended, all videos are edited to follow the Free Use guideline of YouTube.🎵 Track Info:Title: Dark Step by Silent PartnerGenre and Mood: Dance & Electronic + DarkLicense: You're free to use this song and monetize your videos.———⭐ Free Download: https://www.youtube.com/audiolibrary/...———❤️ Optional support (Thanks):Please include the following in your video description (Copy & Paste):––––––––––––––––––––––––––––––Music: Dark Step - Silent Partner https://youtu.be/4r_pXMJ8vlE● 🔥 Leave a comment if you enjoyed!! ● 📁 Get a Contract / Track Stems: https://bsta.rs/50be8f7●👽 Download: https://www.patreon.com/posts/28638879● All of my beats are 100% free to use, however contracts are available.● 🔵 This beat is called Vision 🚡●  BPM 147●  KEY D Minor●  Get a contract: https://bsta.rs/50be8f7●  Twitter: https://twitter.com/unknowncookup●  Instagram: https://www.instagram.com/unknowninst... ●📲 Get Connected 📲●●🔥 Website: https://www.unknowninstrumentalz.com/●🙏 Patreon: https://www.patreon.com/unknowninstru...●👽 Help us reach 💯k! https://www.youtube.com/unknowninstru...●📲 Instagram: Unknowninstrumentalz●📧 Unknowninstrumentalz@gmail.com"
wFGUgnT31Fo,DANCE For PIZZA In Public!! | Ranz and Niana,PH,2019-12-17T13:19:27.000Z,UCdAt_KUKt0g9ZRQ7gwKaN3A,Ranz Kyle,24,19.17.12,ranz kyle|ranz and niana|niana guerrero|niana and ranz|ranz and niana vlog|ranz and niana dance|ranz and niana prank|ranz and niana vlog season 2|natalia guerrero|dance for pizza|dance for pizza in public|public pranks|dance in public|christmas|philippines|challenge|pinoy|vlog|vlogs|prank|pranks|dance off|flash mob|dancing in public,127905,14695,111,2194,https://i.ytimg.com/vi/wFGUgnT31Fo/default.jpg,FALSE,FALSE,Christmas time is near so we gave joy to people by asking them to dance and they get a pizza!! enjoy yall!! and advance merry christmas!!Stalk us on Instagram:https://www.instagram.com/ranzkylehttps://www.instagram.com/nianaguerrerohttps://www.instagram.com/ranzandnianaFacebook:https://www.facebook.com/RanzAndNianahttps://www.facebook.com/nianaguerrerohttps://www.facebook.com/ranzkyle/twitter: @ranzkyle & @nianaguerrerotiktok: @ranzandniana & @ranzandniana.
hh9OYyWg8zg,Miss World 2019 : Top 5 Q & A,PH,2019-12-14T20:03:45.000Z,UCg0BZXZm905Jr8g3S05XPIw,Beauty Pageants,24,19.17.12,miss world 2019 india|miss world 2019 winner|miss india 2019|suman rao|top 5 q and a|miss india|beauty pageant|miss world 2019|miss world 2019 winner crowning moment|miss world|miss world nepal 2019|miss universe 2019|miss world 2019 live|miss world 2019 top 10|miss world india 2019|miss world venezuela 2019|miss world philippines 2019|final miss world 2019|miss world 2019 wales|miss world 2019 nepal|miss world final 2019|toni ann singh,444011,4175,224,781,https://i.ytimg.com/vi/hh9OYyWg8zg/default.jpg,FALSE,FALSE,"Here are the Top 5 Countries during the Question and Answers round  at Miss World 2019 Pageant.Beauty Pageants is your one-stop destination for all that's happening in and around the world of glamour and beauty. Get the latest news and interviews from beauty contests like Femina Miss India, Miss Diva, Mr India, Campus Princess, Fresh Face, Miss World, Miss Universe, Miss Earth, Miss International, Miss United Continents, Miss Supranational, Miss Grand International all under one roof. Check out all exclusive videos on this channel."
Taqh1Zg67jg,GMA-7 NEWS REPORTER CESAR APOLINARIO PUMA-NAW NA SA EDAD NA 46 YEARS OLD! GMA 24 ORAS LATEST NEWS,PH,2019-12-13T07:13:30.000Z,UCS5-lCKkbG8DeSxtSJMIOSw,Abdul TV,22,19.17.12,GMA NEWS LIVE|GMA 24 ORAS LATEST NEWS TODAY|GMA 24 ORAS LIVE|GMA 24 ORAS LIVESTREAM|CESAR APOLINARIO 24 ORAS|CESAR APOLINARIO I JUANDER|CESAR APOLINARIO DOCUMENTARY|CESAR APOLINARIO WITH JOSE HALLORINA|CESAR APOLINARIO REPORT|GMA CHRISTMAS STATION ID 2019|GMA DOCUMENTARIES FULL EPISODE|GMA DOCUMENTARIES 2019|GMA LIVE STREAMING TODAY|GMA LIVE STREAMING KMJS|GMA LIVE STREAMING TODAY PRIMA DONNAS|GMA PRIMA DONNAS LATEST EPISODE|GMA KMJS LIVE STREAMING TODAY,187924,909,121,121,https://i.ytimg.com/vi/Taqh1Zg67jg/default.jpg,FALSE,FALSE,"ISANG NAKAKAGULAT NA BALITA DAHIL PUMA-NAW NA RAW ANG MAGALING NA GMA NEWS REPORTER NA SI CESAR APOLINARIO.PANUORIN !#GMANEWS #24ORAS #GMA724ORAS #GMA24ORAS #CESARAPOLINARION_______________________________________________Sali ka na sa ABDUL TV TEAM!Subscribe here: https://www.youtube.com/channel/UCS5-lCKkbG8DeSxtSJMIOSw📌FOR BUSINESS PURPOSES ONLY!Contact me here: abdultvchannel@gmail.com_____________________________________________📍Credits go to (The Rightful Owner/s for the Slide Pics in this video)____________________________________________📝SOURCE: STEVE DAILISAN TWITTER, CESAR APOLINARIO FACEBOOK PAGE, GMA NEWS_____________________________________________⚠️Copyright Disclaimer Under Section 107 of the Copyright Act 1976, allowance is made for fair use for purposes such as criticism, comment, news reporting, teaching, scholarship, and research. Fair use is a use permitted by copyright statute that might otherwise be infringing. Non-profit, educational or personal use tips the balance in favor of fair use."
