video_id,title,country_code,publishedAt,channelId,channelTitle,categoryId,trending_date,tags,view_count,likes,dislikes,comment_count,thumbnail_link,comments_disabled,ratings_disabled,description
NQcwgZbgLj4,The Try Guys Cook Bagels Without A Recipe,PH,2019-12-14T16:00:06.000Z,UCpi8TJfiA4lKGkaXs__YdBA,The Try Guys,23,19.17.12,try guys|keith|ned|zach|eugene|habersberger|fulmer|kornfeld|yang|buzzfeedvideo|buzzfeed|ariel|ned & ariel|comedy|education|funny|try|learn|fail|experiment|test|tryceratops|without a recipe|baking|cooking|challenge|cooking challenge|baking challenge|chef|chef show|amazing cooking|how to cook|bagel|bagels|frying pan|fried food|how to make|breakfast|breakfast food|baking cookies|cookies|cake|boil|bake|cook|kitchen|easy recipes|recipe|diy|food|taste|tasting|taste test,3494116,153388,2626,13062,https://i.ytimg.com/vi/NQcwgZbgLj4/default.jpg,FALSE,FALSE,"#WithoutARecipe is all you knead! This week the guys are giving bagels a go, but which #TryGuy will dough it right?🥯🏆 Are you a business looking to work with The Try Guys? Reach out to us at 2ndtrybusiness@gmail.com for all business inquiries! 🎧THE TRYPOD 🎧: watch our new podcast at https://youtube.com/trypod or listen at https://tryguys.com/podcast📘THE HIDDEN POWER OF F*CKING UP 📘: check out our new book at https://tryguys.com/bookGet your official Try Guys color hoodies and phone cases at https://tryguys.com/collections/color-line 💙❤️💚💜Support us! http://www.patreon.com/tryguys. Join our Patreon to get videos a day early, plus, live streams, chatrooms, BTS footage, exclusive merchandise, and more!SUBSCRIBE TO AND FOLLOW THE TRY GUYS http://www.youtube.com/c/tryguyshttp://www.facebook.com/tryguys  http://www.twitter.com/tryguyshttps://www.instagram.com/tryguysFOLLOW THE GUYShttp://www.Instagram.com/keithhabshttp://www.Instagram.com/nedfulmerhttp://www.Instagram.com/korndiddyhttp://www.instagram.com/eugeneleeyang http://www.twitter.com/keithhabshttp://www.twitter.com/nedfulmer http://www.twitter.com/korndiddyhttp://www.twitter.com/eugeneleeyang THE TRY GUYSThe #TryGuys is the flagship channel of 2ND TRY, LLC. Tune in twice a week for shows from Keith, Ned, Zach and Eugene, the creators and stars of The Try Guys.APPEARANCESJamie - Rank Kid Jessica Schupack - Marketing ConsultantFind her on Instagram @classiceventsandmarketingNick Schreiber - Chef & Owner of Belle’s Bagels @bitchdontkillmyschreibJD Rocchio - Chief Bagel Officer & Owner of Belle’s BagelsBelle’s Bagelswww.bellesbagels.com@bellesbagels on Instagram and Twitter Reece Scelfo - Owner of Brady’s Bakerywww.bradysbakery.comIG: @bradysbakeryVoice Over by Devlin McCluskeyLOCATIONLight Lab@lightlab www.lightlabla.com Special Thanks Jessica Schupack, Stephanie Levine & Susan Levison, Anne SageEDITED BY Devlin McCluskey  EPISODE CREW Directed by Rachel Ann Cole   Director of Photography - Stephen TringaliCamera Operator - Vito HuizarCamera Operator - Nathan MeadeCamera Operator - Dante Skartoni1st Assistant Camera - Melanie Adams2nd Assistant Camera - Nicole Kent2nd Assistant Camera - Jennifer PawlowskiGo Pro Camera Assistant - Miles Bonsignore Demo Camera Operator - Dawn ShimDIT - Greg KarpinskiGaffer - George SugarBest Boy Electric - Brandon WintersKey Grip - Nate ThompsonKey Grip - Andrew EnloeBest Boy Grip - Alberto GonzalesSound Mixer - Evan MenakBoom Operator - Rory O’ConnellBoom Operator - Daniel WonacottProduction Designer - Susannah HoneyArt Director - Megan SunzeriFood Stylist - Niki Ford Art Production Assistant - Samuel JohnsonProduction Manager - Alexandria HerringSet Production Assistant - Jonathan KirkAssistant Editor - Will WitwerOvernight Editor - Bryan SandlinOvernight Editor - Rosalie Fischer VENDORSCamera provided by The Camera DivisionGrip & Electric provided by Lightspeed Grip & LightingProduction Supplies provided by Walk & Talk Rentals  MUSICLicensed from AudioNetwork SFXLicensed from Audioblocks VIDEOLicensed from VideoblocksFood vector created by natalka_dmitrova - https://www.freepik.com/free-photos-vectors/food Official Try Guys PhotosBy Mandee Johnson Photography | @mandeephoto 2nd Try, LLC STAFFExecutive Producer - Keith HabersbergerExecutive Producer - Ned FulmerExecutive Producer - Zach KornfeldExecutive Producer - Eugene Lee YangProducer - Rachel Ann ColeProducer - Nick RufcaProduction Manager - Alexandria HerringEditor - Devlin McCluskeyEditor - YB ChangEditor - Elliot DickerhoofAssistant Editor - Will WitwerCamera Operator - Miles BonsignoreSound Operator - Jonathan Kirk Production Assistant - Sam JohnsonContent Strategist - Kaylin Burke Special Thanks To!Thanks to all of our Gold Level Patrons! AJ S., Amy Fleming, Ana Camba, Cat Hicks, Elisa Proust, Emma Godfrey, Erica Rao, Jared Aarons, Kelsey Bock, Kourtney Wong, Loretta Wen, Matthew Tadros, Miha, Paulus, Sarah Waxman, Traci Lew, Wendy Tran, Lily"
vkijZnP9Nl8,BABAE IKINULONG NG 25 YEARS DAHIL SA PAGIBIG | Kaalaman,PH,2019-12-16T08:36:00.000Z,UCTfv9FQ_wKXIjzCIHxnSn2A,Kaalaman,27,19.17.12,KMJS|FlipTop|Kaalaman|Knowledge|Filipiknows|Information|Wish107.5|PGT|PilipinasGotTalent|Viral|Philippines|Theory|Duterte|Agriculture|Pet|Trivia|facts|Tagalog Facts,91899,4710,67,721,https://i.ytimg.com/vi/vkijZnP9Nl8/default.jpg,FALSE,FALSE,"Ang channel na Kaalaman o sa wikang ingles ay Knowledge, Ay pinapalakad lamang ng isang maliit na grupo, Ang channel na ito ay ginawa para makapagbigay ng .... Well Kaalaman! sa mga Pilipino sa loob at labas ng bansa, Hindi hangad ng channel na ito na siraan o dungisan ang kahit na sino o gawa ng ibang tao, Ang lahat ng makikita sa video ay nakuha lamang sa internet at maaaring mayroong tao na ayaw magamit/makuha ang kanyang gawa, Asahan niyong Gagawin namin ang lahat para mabigyan lahat ng credits kung sino o ano man ang nasa video, Gayon paman kung sakali man na ayaw niyo na magamit ang inyong litrato/video/gawa ay marapat lamang na mag email sa ibaba.Humihingi din po ako ng paumanhin kung minsan hindi ko kayo mareplayan lahat sa mga comment ninyo, Sana sa video natin ngayon, nakapagbigay ako ng kaunting kaalaman upang magamit ninyo sa eskwelahan, usapang barkada o kahit pamilya, Asahan niyo na patuloy tayong gagawa ng ganitong mga video at gagawin ko lahat ng makakaya ko para kahit papaano makasagot ako sa inyong mga kumento, Maraming Salamat ulit aking mga kaibigan.Love Story by Jonny EastonLink: https://youtu.be/YcGEBptSSQkCheck out his channelLink: https://www.youtube.com/jonnyeaston--------------------------------------------------------------------------------► i-Like ang ating Official facebook page ◄https://www.facebook.com/Kaalaman-2269921299925976/--------------------------------------------------------------------------------► For Business / Copyright matter please email us ◄kaalamanhq@yahoo.com--------------------------------------------------------------------------------*Copyright Disclaimer Under Section 107 of the Copyright Act 1976, allowance is made for fair use for purposes such as criticism, comment, news reporting, teaching, scholarship, and research. Fair use is a use permitted by copyright statute that might otherwise be infringing, ALL RIGHTS BELONG TO THEIR RESPECTIVE OWNERS*#Kaalaman #Pagmamahalan #Love"
cYbZq1MWGik,PREMONIS YON Sa NANGYARI Kay MICO PALANCA Viral!,PH,2019-12-11T02:15:14.000Z,UCi9BnXd3lRCQU8XStz8VyFQ,Oh My Chika,22,19.17.12,sa|nangyari|kay|mico|palanca,352672,1262,599,17,https://i.ytimg.com/vi/cYbZq1MWGik/default.jpg,FALSE,FALSE,Isa nga ba itong premonisyon o twist of fate sa sinapit ng actor na si Mico Palanca?
a9m3GD0DbPY,Baking A Wedding Cake With Every Possible Cake Flavor In It,PH,2019-12-15T21:21:11.000Z,UCbAwSkqJ1W_Eg7wr3cp5BUA,Safiya Nygaard,22,19.17.12,baking a wedding cake with every possible cake flavor in it|wedding cake|cake|baking|frankencake|mixing cake mixes|cake mixes|safiya nygaard|safiya wedding|safiya|safia|safiya and tyler|rosanna pansino|baking cakes|cake flavors,3446175,214243,2788,12835,https://i.ytimg.com/vi/a9m3GD0DbPY/default.jpg,FALSE,FALSE,"You can check out our Colourpop frankenlipsticks here! https://colourpop.com/collections/safiya-nygaard-makeupAnd now I present to you, part 2 of our 4-part wedding series! We had to make a franken-wedding-something, so why not a cake? We decided to bake an 8-tier wedding cake where each layer is a different cake flavor, and then at the end taste them as tiers and all together. What do you guys think? Do you want a franken-cake at your wedding? Should we keep doing bad culinary science or retire our spatulas for good?Thank you so much to Rosanna Pansino for helping us bake our cake! You can find her channel here: https://www.youtube.com/user/RosannaPansinoDon’t forget to click the bell to turn on post notifications!Merch: https://fiendsbysaf.com/Safiya's IG: https://www.instagram.com/safiyany/Twitter: https://twitter.com/safiyajnFacebook: https://www.facebook.com/safnygaard/Assistant Editors: Emily Linden, Claire Wiley, Josie Latino, & Ben Chrobak-PrinceMusicvia Audio NetworkSFXVia Audioblocks"
oiLw1nNWOgY,Pool in General Santos City overflows due to magnitude 6.9 earthquake in Davao del Sur,PH,2019-12-15T08:38:00.000Z,UCdnZdQxYXnbN4uWJg96oGxw,Rappler,25,19.17.12,#QuakePH,906649,2886,307,515,https://i.ytimg.com/vi/oiLw1nNWOgY/default.jpg,FALSE,FALSE,"The earthquake that rocked parts of Mindanao caused a pool at Palmera Garden Hotel in General Santos City to make waves and overflow on Sunday afternoon, December 15. #QuakePH"
TmheraCOEXo,SNOW Bean | (Mr Bean Season 3) | NEW Funny Clips | Mr Bean Official,PH,2019-12-16T14:00:09.000Z,UCkAGrHCLFmlK3H2kd6isipg,Mr Bean,23,19.17.12,mister bean|MR BEAN|mister bin|mr bean 2017|english comedy|bean|rowan atkinson|mr bean new|mr. bean|mr bean funny|mr bean compilation|comedy|compilation|family friendly|mr bean episode|funny clips|mr bean official|new funny clips|mr bean 2018|mr bean cartoon|mr bean cartoons|cartoons for kids|mr bean animated|Kids cartoons full episodes|funny videos 2019|season 3|christmas|snow|snowing|christmas snow|freezing|big freeze,358008,3618,534,140,https://i.ytimg.com/vi/TmheraCOEXo/default.jpg,FALSE,FALSE,"Mr Bean wakes up to a scene from a Christmas card with lots and lots of snow!Stay tuned:https://www.youtube.com/channel/UCkAGrHCLFmlK3H2kd6isipg?sub_confirmation=1Welcome to the official Mr Bean Channel. Here you will find all of your favourite Mr Bean moments from the classic series with Rowan Atkinson and his new animated adventures. Make sure to subscribe and never miss a Full Episode of Mr Bean, or Mr Bean Compilations and clips as well as originals including Mr Bean Comics.To find out more about Mr Bean visit:Mr Bean on Facebookhttp://www.facebook.com/mrbeanFollow us on Twitterhttp://www.twitter.com/mrbeanMore Mr. Beanhttps://www.youtube.com/playlist?list=PLC1EDzqtkrh_Zj67UUTZZmRfrgqwyZNlW"
h5rliCqB-4Y,REAL FOOD VS GUMMY || Eating World’s Largest Gummy! GIANT FOOD Tasting by 123 GO! Challenge,PH,2019-12-07T01:00:07.000Z,UC_O-vmjpkom1m5shISID94g,123 GO! CHALLENGE,22,19.17.12,challenge|challenges|prank|pranks|fun|funny|123 go|123go|DIY|123 go challenge|123go challenge|giant food|largest food|largest gummy|food challenge|real vs gummy|food tasting|food tasting challenge|gummy vs real,5133809,43121,5618,1440,https://i.ytimg.com/vi/h5rliCqB-4Y/default.jpg,FALSE,FALSE,"Okay, so you’ve seen us do some food challenges before. But none of them compare to this stomach turning competition.If given the opportunity, would you choose gummy food over the real thing? Leave your comment below 👇Share this hilarious video with your friends and be sure to subscribe to the 123Go! Challenge YouTube page for more awesome content! Thanks for watching!#123GO  #GummyVsReal #FoodChallenge #Giant Music by Epidemic Sound: https://www.epidemicsound.com/Stock materials:https://www.depositphotos.comhttps://www.shutterstock.comhttps://elements.envato.com"
gIOyB9ZXn8s,"Idina Menzel, AURORA - Into the Unknown (From Frozen 2)",PH,2019-12-04T16:30:01.000Z,UCgwv23FVv3lqh567yagXfNg,DisneyMusicVEVO,10,19.17.12,Into the Unknown|Idina Menzel Into the Unknown|Idina Menzel Aurora|Frozen 2|Kristen Anderson-Lopez|Robert Lopez|Bobby Lopez|Christophe Beck|Let It Go|Elsa|Elsa Into the Unknown|Into the Unknown Elsa|TAEYEON|David Bisbal,39705477,923401,22169,42931,https://i.ytimg.com/vi/gIOyB9ZXn8s/default.jpg,FALSE,FALSE,"Watch the full “Into the Unknown” sequence from Disney’s Frozen 2 featuring the original song performed by Idina Menzel (voice of Elsa) featuring AURORA and written by Academy Award winners Kristen Anderson-Lopez & Robert Lopez. See Disney’s Frozen 2 in theaters now. Get your tickets here: http://bit.ly/Frozen2TicketsWatch all Frozen 2 music videos here: http://disneymusic.co/frozen2playlist/vevo?IQid=dmvevo.f2Frozen 2 soundtrack is available now! Get it here: https://disneymusic.co/Frozen2?IQid=dmvevo.f2Subscribe to DisneyMusicVEVO: https://disneymusic.co/disneymusicYT?IQid=dmvevo.f2Into the Unknown sheet music:Musicnotes: https://www.musicnotes.com/l/MN0204329Sheet Music Direct: https://www.sheetmusicdirect.com/en-US/se/ID_No/432054/Product.aspx🍁🍂🍁🍂🍁🍂Why was Elsa born with magical powers? What truths about the past await Elsa as she ventures into the unknown to the enchanted forests and dark seas beyond Arendelle? The answers are calling her but also threatening her kingdom. Together with Anna, Kristoff, Olaf and Sven, she'll face a dangerous but remarkable journey. In “Frozen,” Elsa feared her powers were too much for the world. In “Frozen 2,” she must hope they are enough. From the Academy Award®-winning team—directors Jennifer Lee and Chris Buck, producer Peter Del Vecho and songwriters Kristen Anderson-Lopez and Robert Lopez—and featuring the voices of Idina Menzel, Kristen Bell, Jonathan Groff and Josh Gad, Walt Disney Animation Studios’ “Frozen 2” opens in U.S. theaters on Nov. 22, 2019.🍁🍂🍁🍂🍁🍂Connect with Disney Music on:Instagram: https://instagram.com/disneymusicFacebook: https://facebook.com/disneymusicTwitter: https://twitter.com/disneymusicFor more Frozen 2:Facebook: https://facebook.com/DisneyFrozenTwitter: https://twitter.com/DisneyFrozenIG: https://www.instagram.com/DisneyFrozen#Frozen2 #IdinaMenzel #IntoTheUnknownMusic video by Idina Menzel, AURORA performing Into the Unknown (From Frozen 2). © 2019 Walt Disney Records"
BhJZ2uSG8HI,SEA Games CLOSING CEREMONY 2019 Foreigners BLOWN AWAY,PH,2019-12-11T22:45:00.000Z,UCuS5fmeEDpnW5JPMdRhGm7A,Making it happen Vlog,19,19.17.12,#SEAGames2019|#Philippines|#SEAGamesClosingCeremony2019 SEA Games 2019|SEA Games 2019 Highlights|sea games closing ceremony 2019|sea games live|sea games highlights|LIFE Manila|Mike and Nelly|Manila Philippines|Philippines|Philippines Vlogger|Black Eyed Peas SEA Games,661880,25042,371,1632,https://i.ytimg.com/vi/BhJZ2uSG8HI/default.jpg,FALSE,FALSE,"We finally made it to the SEA Games 2019 in the Philippines and we actually went to Clark City to experience the SEA Games Closing Ceremony LIVE! See our reactions of this unique experience.Follow our ADVENTURES 🤗 https://linktr.ee/makingithappenvlog(don’t miss out on watching some behind the scenes on Instagram stories :)▬▬▬YOU TRAVEL A LOT AND NEED INSURANCE? Check out SafetyWing - the Travel Medical Insurance, we signed up with which saved us from lots of worries:https://www.safetywing.com/?referenceID=24734727▬▬▬SAVE SOME MONEY ON YOUR NEXT ACCOMMODATION💰AIRBNB:👇🏼👇🏼👇🏼and get up to $42 off your next stay by signing up with our link:https://www.airbnb.com/c/michaelh25656?currency=USDBOOKING.com👇🏼👇🏼👇🏼Get 10% off your next booking by using our link:http://www.booking.com/s/27_8/d63b33a6▬▬▬MUSIC:We get all of our music from Musicbed. Sign up and download your favourite songs:👇🏼👇🏼👇🏼🎵 Get a free 30 day trial of the music service we use here: http://share.mscbd.fm/makingithappenvlog▬▬▬👚 GET OUR MERCH HERE: http://bit.ly/MakingItHappenMERCH100% of our Merch proceeds are donated to the Kalipay Negrense Foundation to bring joy and a better future to disadvantaged Filipinos 🇵🇭We wanted to give you an overview and full transparancy about our Making It Happen Merch Donations for Kalipay Negrense FoundationTherefore we will upload the monthly sales reports in this folder so you can check every month how much YOU guys contributed for a good cause by supporting our little project for Giving Back 🙏🏼Here is the link: https://bit.ly/34tK9zOIf you have any questions, feel free to reach out to us via email: mike.makingithappen@gmail.com▬▬▬JOIN OUR MAILING LIST AND SAVE MONEY✈️ We will inform you once per week about new behind the scenes of travel updates,* the hottest hotels,* insights on equipment and lifestyle products we are using,* tips and tricks for videography and photography * the best travel hacks and deals. You don't want to miss out, when it comes to saving some money ;)Sign up for FREE with your email here: https://geni.us/MakingItHappenVlogNEWS▬▬▬ABOUT US:We are Mike and Nelly, two passionate travellers who love to immerse themselves into new cultures and experiences all around the globe. We are always up for travels that involve amazing people, good food, great coffee and the next adventure. We love capturing these moments on our Travel Vlogs.SUBSCRIBE for TRAVEL, FOOD and  GOOD VIBES.LETS STAY IN TOUCH:🤗 click the links to follow us on our other social channelshttps://linktr.ee/makingithappenvlogWORK WITH US:📬 mike.makingithappen@gmail.com▬▬▬TAGS:#SEAGames2019#Philippines,#SEAGamesClosingCeremony2019Black Eyed Peas SEA Games,SEA Games 2019,SEA Games 2019 Highlights,sea games closing ceremony 2019,sea games live,sea games highlights,LIFE Manila,Mike and Nelly,Manila Philippines,Philippines,Philippines Vlogger,"
P6T539vk4hk,Zombie Apocalypse Survival Hacks – Episode 8,PH,2019-12-15T15:00:02.000Z,UCIJ44QRtVGm_gBh_deuL5ow,Troom Troom SELECT,26,19.17.12,Zombie|Zombie Apocalypse|Survival|Survival Hacks|Zombie Apocalypse Survival Hacks|DIY Zombie Apocalypse Survival Hacks|mystery|spying|fun|pause|funny|in real life|you wont do it|game|last to|last to leave|survive|last to survive|zombies|surviving|survival|Troom Troom|tv show,518285,9690,472,1434,https://i.ytimg.com/vi/P6T539vk4hk/default.jpg,FALSE,FALSE,"Subscribe Here: https://www.youtube.com/channel/UCIJ44QRtVGm_gBh_deuL5ow?sub_confirmation=112 Christmas Magic Tricks And Pranks With Grinch!: https://youtu.be/IyI5c2ZN7Ok?list=PLStfTQaLmLwhyHZVejgcUaoDpZiOOMfPfMusic:Track: NIVIRO - The Return [NCS Release]Music provided by NoCopyrightSounds.Watch: https://youtu.be/R0QkZOyuqIsFree Download / Stream: http://ncs.io/TheReturnYOSong: NIVIRO - The Ghost [NCS Release] Music provided by NoCopyrightSounds.Video: https://youtu.be/lTEzfj8IAR0Download: http://http://ncs.io/TheGhostWatch More Troom Troom SELECT: Popular Videos: 19 Magic Tricks To Impress Your Friends: https://youtu.be/Q5xSe3kqvNA16 Edible School Supplies! Prank Wars!: https://youtu.be/E9aPzuA7sJI19 Life Hacks To Make Your Life Easier: https://youtu.be/PN1D8JKpOgo16 Cool Things You Can Make With Glue Gun: https://youtu.be/ZjB6DPEO7AU14 Hot Glue Gun Life Hacks For Crafting: https://youtu.be/3aAy4smn_rgPopular Playlists:Magic Tricks: https://www.youtube.com/playlist?list=PLStfTQaLmLwj_ApLmpN3wOsYnsIDqKWwoBest pranks: https://www.youtube.com/playlist?list=PLStfTQaLmLwgNIPT7UKfSMX7NPt7dCBYvBack to School:https://www.youtube.com/playlist?list=PLStfTQaLmLwh3UFdm5MCoJu6G3nfhvbSRBest Life Hacks: https://www.youtube.com/playlist?list=PLStfTQaLmLwjMIZoW29M2-zs3s_RXphngHome Decor Ideas: https://www.youtube.com/playlist?list=PLStfTQaLmLwjEC9v9ULlK4hmjBd15MbLiFollow Troom Troom Select:Subscribe: https://www.youtube.com/channel/UCIJ44QRtVGm_gBh_deuL5ow?sub_confirmation=1Instagram: https://www.instagram.com/troom_selectFacebook: https://www.facebook.com/troomhandsPinterest: https://pinterest.com/troomtroom/Troom Troom Español: Subscribe: https://www.youtube.com/channel/UCu6oyJJ6PlkeNNv6n26ZNyA?sub_confirmation=1Troom Troom Française:Subscribe: https://www.youtube.com/channel/UCyNeKmBHI10u4bwYEKimlZA?sub_confirmation=1Troom Troom Russian: Subscribe: https://www.youtube.com/channel/UCq1JpGFxcZTbbOAz010U-og?sub_confirmation=1Troom Troom Deutsch:Subscribe:  https://www.youtube.com/channel/UCzgmxZIlgfH1fgch7OpigIA?sub_confirmation=1Troom Troom Chinese:Subscribe:  https://www.youtube.com/channel/UCV3NWBs2K7pOEGmI4w_2dhg?sub_confirmation=1Troom Troom Português:Subscribe: https://www.youtube.com/channel/UCgCQlMYN2XypwYC2wcR32bA?sub_confirmation=1Troom Troom Japanese:Subscribe: https://www.youtube.com/channel/UCPCwT9JMWPjg6xAWrQxhQaw?sub_confirmation=1About Troom Troom Select: Easy DIY how to video tutorials. DIY Accessories, Scrapbooking Cards, Home Décor, Make Up Tutorials, Life Hacks, and MUCH more! Make it easy! For any business enquires please contact me at: troomtroomdiy@gmail.comQuestion of the Day: what magic trick did you like the most? Comment Below!Don’t forget to turn on notifications, like, & subscribe!"
t4vUV6NZQC8,PANGMALAKASANG CHRISTMAS PARTY (with KWEEN LC AND MADAMS!),PH,2019-12-16T11:35:24.000Z,UCkcqvHqQsGbj21eY6xCPt2g,BNT Production,23,19.17.12,chrismas|pasko|partychristmas party|madam aivan|madam ely|lloyd cadena|lloyd cafe cadena|kween lc|bnt|bakla ng taon|bnt production|funny|comedy|vlogs,63310,3011,39,390,https://i.ytimg.com/vi/t4vUV6NZQC8/default.jpg,FALSE,FALSE,"Maraming salamat kuya Lloyd sa sobrang sayang party na ituuuu!Official Social Media accountsFacebook - https://www.facebook.com/BekiNgTaon/Twitter - https://twitter.com/BNTProductionInstagram - http://instagram.com/baklangtaon/Send us something:Name: Ely Concord Delos SantosAddress: Unit 303 3/F JTB Bldg., 2165 P. Binay St., Brgy. Bangkal Makati Cityc/o Madame Ely - 09495696476For better quality please watch in HD"
Xz15Ur-EeLw,Daig Kayo Ng Lola Ko: Carol's magical transformation,PH,2019-12-16T07:05:17.000Z,UCMBGrCnS_HzAH4ktKT4oNTw,GMA Playground,24,19.17.12,GMA|GMA Network|GMA Playground|Entertainment|Kids|Fantasy|Daig Kayo Ng Lola Ko|Daig Kayo Ng Lola Ko GMA|Daig Kayo Ng Lola Ko December 15 2019|Daig Kayo ng Lola Ko December 15 2019 full episode|David Remo|Chlaui Malayao|Angelica Ulip|TJ Daylusan|Boots Anson-Roa|Maine Mendoza|Yaya Dub|Jenine Desiderio|Baste|Radson Flores|Arny Ross|Rob Moya|Elle Ramirez|Andrew Gan|Tammy Brown|Daig Kayo Ng Lola Ko Maine Mendoza|Daig kayo ng lola ko episode highlights,36905,581,32,19,https://i.ytimg.com/vi/Xz15Ur-EeLw/default.jpg,FALSE,FALSE,"Aired (December 15, 2019): Tuwang-tuwa si Carol (Maine Mendoza) dahil ang kahilingan niyang maging tao ay natupad matapos ang biglaang pag-ulan ng niyebe.Watch 'Daig Kayo ng Lola Ko' Sundays at 6:55 PM on GMA Network, starring Ms. Gloria Romero, Chlaui Malayao, David Remo, Angelica Ulip and TJ Daylusan. This month's special stars Jasmine Curtis, Ruru Madrid, Sophie Albert, Sef Cadayona, Liezel Lopez, and Julius Miguel. #DaigKayoNgLolaKo #MaineTransformsOnDaig #DaigKayoNgLolaKoEpisodeHighlights"
kMIneE338bk,"Mas Malakas pa kay Thirdy? | Tinitiliang Big Guard , Sikat na kahit hindi pa naglalaro",PH,2019-12-16T00:16:24.000Z,UCB6i-DuHN_2cwuDm7Eb6XcA,Basketball PH Rev,17,19.17.12,kai sotto|gilas|batang gilas|ricci rivero|aj edu|remy martin|juan gomez de liano|kobe paras|terrence romeo|andray blatche|pba|abl|ray parks|alab|ginebra|san miguel|smb|jordan clarkson|ramos brothers|dwight ramos|eli ramos|fil-am|ateneo|ateneo season83|thirdy ravena,134387,1290,37,86,https://i.ytimg.com/vi/kMIneE338bk/default.jpg,FALSE,FALSE,"Welcome Back sa Basketball PH Rev!!!Kamusta mga Bro at SisesPlease Like Our Facebook Page: https://www.facebook.com/basketballphreview/?ref=aymt_homepage_panel&eid=ARDr9px669F03MxVkT7Gs29tAM3TtGnqeibVgbYRxJBxtlN5od27GKTivyaZGCQDtDGbB6bVGaw0I3JR___________DISCLAIMER:This video is edited under by Fair Use Law of Youtube.No Copyright Infringement is intended. Credits to theowner of the video clips , images , etc.___________Royalty Free Music:Battle - Upkeys (Creative Commons Music)*Business Inquiry* Email: ueldoitall@gmail.com"
oGDGvCgiTZY,COOL WAYS TO SNEAK FOOD INTO CLASS || Back To School Hacks and Pranks by 123 GO!,PH,2019-12-09T16:30:03.000Z,UCBXNpF6k2n8dsI6nBH8q4sQ,123 GO!,22,19.17.12,DIY|craft|crafts|prank|pranks|challenge|challenges|fun|funny|123GO!|123 go|123go|friends|friendly|tutorial|howto|how to,4545110,31466,3805,1434,https://i.ytimg.com/vi/oGDGvCgiTZY/default.jpg,FALSE,FALSE,"No matter what you’re up to, hunger can strike at any time. And thanks to these clever hacks, we’ll show you how to get munching ASAP — even if it’s smack-dab in the middle of the classroom.Ready to stop those tummy grumbles with these lifesaving school snack hacks? Then be sure to share these with your classmates and get grubbin’! Don’t forget to subscribe to out 123 GO! YouTube channel for more awesome videos just like this one.  Happy snacking, friends!#funny #schoolhacks #DIYMusic by Epidemic Sound: https://www.epidemicsound.com/Stock materials: https://www.depositphotos.comhttps://www.shutterstock.com"
