video_id,title,country_code,publishedAt,channelId,channelTitle,categoryId,trending_date,tags,view_count,likes,dislikes,comment_count,thumbnail_link,comments_disabled,ratings_disabled,description
xENqVdutxtI,SILIP - 2007 - FULL MOVIE - BEST TAGALOG BOLD,PH,2019-12-15T23:58:33.000Z,UCfrVJqr001Y6cd8Drx_mmQg,Tagalove,1,19.17.12,pinoy movie|spiny movies|full pinoy movie|full pinoy movies|pinoy movie 2018|pinoy movies 2019|pinoy movies comedu|pinoy movies 2018|pinoy movie trailer|pinoy movie 2018 full movies|pinoy movie 2019 full movies|tagalog movie|tagalog movies|hd tagalog movies|hd tagalog full movies|free Tagalog movies|silip|Diana Zubiri|Francine Prieto|polo ravales|bold movies|tagalog bold,924785,4674,987,1083,https://i.ytimg.com/vi/xENqVdutxtI/default.jpg,FALSE,FALSE,"💥💥 DON'T FORGET TO SUBSCRIBE💥💥SILIP - 2007 - FULL MOVIE - Small-town waitress Tess (Diana) is swept off her feet by dashing salesman Rico (Polo), who marries her and takes her to live on his isolated farm. When Rico goes on a sales trip and leaves her all alone, Tess fights off loneliness by befriending Celia (Francine).TAGALOVE! The Best Pinoy Movie Collection!💥💥 DON'T FORGET TO SUBSCRIBE💥💥Follow TAGALOVE on Social Media and don't miss next release!FACEBOOK ➡️ https://www.facebook.com/tagalovemovie/INSTAGRAM ➡️ https://www.instagram.com/tagalovemovie/❤️❤️ TAGALOG - MOVIES WE LOVE ❤️❤️"
4U3FpPctBkA,"Vice Ganda, nakaganti na kay Hashtag Nikko! | PRANK CALL!",PH,2019-12-12T23:00:12.000Z,UCHP8j1ErYzpkT5KaVVymtdA,MOR 101.9 For Life!,24,19.17.12,ABS-CBN|ABS-CBN FM|MOR 101.9 For Life|Radio|FM Radio|My Only Radio For Life|www.mor1019.com|Tambayan|prank call|vice ganda|nikko|Vice Ganda|nakaganti na kay Hashtag Nikko|Vice Ganda mor|Vice Ganda prank call|Prank call vice|Vice Ganda and nikko|Hashtag nikko|hashtag nikko vice ganda|raymund marasigan|direk bobet|vice ganda its showtime|hashtag nikko mor|nikko natividad mor|nikko natividad prank call|20191213mor101.9|December 13 2019|YT0psMille,2539190,64759,1409,3258,https://i.ytimg.com/vi/4U3FpPctBkA/default.jpg,FALSE,FALSE,May mapapatalsik sa Showtime dahil naglagay ng BOTE sa loob ng BRIEF habang on-air? Nako! Mapapatalsik nga ba o talagang nabawian lang ni Meme si Hashtag Nikko? Haha! Watch mo na kaMORkada!For MORe videos subscribe now:http://bit.ly/MORForLifeFollow us on Instagram:https://www.instagram.com/mor1019forlifeLike us on Facebook: http://facebook.com/mor1019Follow us on Twitter: http://twitter.com/mor1019Check out our livestreaming at:http://www.mor1019.com
TLBrMhWVC3A,"Kapuso Mo, Jessica Soho: Floating ataul, namataan sa Zamboanga del Sur?!",PH,2019-12-16T09:30:11.000Z,UCj5RwDivLksanrNvkW0FB4w,GMA Public Affairs,25,19.17.12,GMA|GMA 7|GMA Public Affairs|Public Affairs|Magazine|Kapuso Mo Jessica Soho|KMJS|Jessica Soho|KMJS 2019|Kapuso Mo Jessica Soho December 15 2019|KMJS December 15 2019 full episode|KMJS full episode|KMJS latest episode|Kapuso Mo Jessica Soho latest episode|KMJS Dec 15 2019|Kapuso Mo Jessica Soho Dec 15 2019|KMJS Horror|KMJS Horror 2019|KMJS Floating Ataul|Floating Ataul KMJS|floating ataul|KMJS Nakakatakot|floating kabaong|floating kabaong kmjs|floating,1926717,16950,1455,2215,https://i.ytimg.com/vi/TLBrMhWVC3A/default.jpg,FALSE,FALSE,"Aired (December 15, 2019): Sa karagatan ng Zamboanga del Sur, may nakitang palutang-lutang na...ataul?! Totoo nga bang may kababalaghan na bumabalot dito? Panoorin ang video!‘Kapuso Mo, Jessica Soho’ is GMA Network's highest-rating magazine show. Hosted by the country’s most awarded broadcast journalist Jessica Soho, it features stories on food, urban legends, trends, and pop culture. ‘KMJS’ airs every Sunday, 8:40 PM on GMA Network.Subscribe to youtube.com/gmapublicaffairs for our full episodes. #KMJS15GMA promotes healthy debate and conversation online.  Any abusive language that does not facilitate productive discourse will be blocked from this post.    GMA upholds ethical standards of fairness, objectivity, accuracy, transparency, balance, and independence. Walang Kinikilingan, Walang Pinoprotektahan, Serbisyong totoo lamang. Subscribe to the GMA Public Affairs channel: https://www.youtube.com/user/gmapublicaffairsVisit the GMA News and Public Affairs Portal: http://www.gmanews.tvConnect with us on:Facebook: http://www.facebook.com/gmapublicaffairs/Twitter: http://www.twitter.com/gma_pa"
0j9MfpYWrYo,MUKBANG NG LUTO NG TATAY KO WITH ALEX GONZAGA + Q&A (MAY CALLSIGN NA KAMI! ),PH,2019-12-13T09:45:02.000Z,UCP8eztbhAp7_928o3ng8rmQ,mimiyuuuh,22,19.17.12,OPPOA92020|AlwaysGwithOPPOA9|PamaskOPPO|Mimiyuuuh|tubig|drink|drinkyourwater|funny|nakakatawa|gay|gayvlogger|pinoy|pinoyvlogger|dalagangpilipina|dalaga|pilipina|almost|hype|yourself|vocalizinationism|filipino|viral|trending|MARIAH CAREY|FILIPINO SINGER|SINGER|SONG COVER|COVER|SKINCARE|KOREAN|CAVITE|KAWIT|TRAVEL|TOURGUIDE|TOUR|GUIDE|water|karoling|skincare|nangaroling|christmas|Christmassong|Pasko|paskongpinoy|waze|lazada|Merry Christmas|MIMI|VLOGMAS|ALEX GONZAGA|AMFEE,2035312,82846,997,6964,https://i.ytimg.com/vi/0j9MfpYWrYo/default.jpg,FALSE,FALSE,Thank you tatay Amadz for the fuds opo! OPPO! #OPPOA92020 #AlwaysGwithOPPOA9 #PamaskOPPOFOLLOW MS. ALEX G:YOUTUBE: https://www.youtube.com/channel/UC6N-9Wh0DYhDI8sQS7jwjVAINSTAGRAM: https://www.instagram.com/cathygonzaga/?hl=en______________________________________________________FOLLOW ME ON MY SOCIAL MEDIA JOIN MIMINIZATIONISM!!!!!!!!!! BAKA MAY PA MEET & GREET!!!!!https://www.facebook.com/groups/461149874691856/?source_id=339728919959895INSTAGRAM: https://www.instagram.com/mimiyuuuh/TWITTER: https://twitter.com/mimiyuuuhFACEBOOK: https://www.facebook.com/mimiyuuuhBUSINESS/PR/RAKET: mimiyuuuh@gmail.com
DcUKAHUzfuw,4 Misteryosong Lugar na WALANG GRAVITY sa ating Planeta - Lulutang ka?,PH,2019-12-14T05:28:57.000Z,UCfv5QHzKKn26W6A5y5l1pLg,ClarkTV Facts,26,19.17.12,clarktv|clarktv facts|clark tv|4 Misteryosong Lugar na WALANG GRAVITY - Lulutang ka?|lugar na walang gravity|lugar na lulutang ka|claro the third|congtv|alex gonzaga|mystery spot|magnetic hill|reverse waterfall,774935,9445,665,810,https://i.ytimg.com/vi/DcUKAHUzfuw/default.jpg,FALSE,FALSE,4 Misteryosong Lugar na WALANG GRAVITY - Lulutang ka? Sources: ►Paano Magsimula sa Youtube at Kumita ng Pera? Click here: https://clarkarandia.com/5stepyoutuber►5 Steps Paano Maging Youtube Vlogger at Kumita ng Pera? Click here: https://clarkarandia.com/5stepyoutuber►Paano Gumawa ng Video katulad kay ClarkTV? Click here: https://clarkarandia.com/videocreation►Paano Magkaroon ng Madaming Views at Subscribers sa Youtube?Click here: https://clarkarandia.com/ytgrowth►Paano ako gumagawa ng Youtube Videos? Click here: https://clarkarandia.com/videocreationMy Website►https://www.clarkarandia.com#clarktv #clarktvfacts ▬▬▬▬▬▬▬▬▬▬▬▬▬▬▬▬▬▬▬▬▬▬▬Follow ClarkTV Facts on Social MediaFB Page: https://www.facebook.com/clarktvfactsytFB Profile: https://www.facebook.com/clarkarandiaInstagram: https://www.instagram.com/clark.arandiaWhat this Video is About:4 Misteryosong Lugar na WALANG GRAVITY - Lulutang ka?
BuAURiD4Wmw,Maroon 5 - Memories (Lyrics),PH,2019-12-11T14:24:51.000Z,UCoUk9iNey2e-g3XtnaNGlQA,Mr Shades,10,19.17.12,Maroon 5|Memories|maroon 5 memories|maroon 5 memories lyrics|memories maroon 5|memories maroon 5 lyrics|memories lyrics|memories lyrics maroon 5|maroon 5 new song,4620686,44284,1374,943,https://i.ytimg.com/vi/BuAURiD4Wmw/default.jpg,FALSE,FALSE,"Maroon 5 - Memories (Lyrics)Stream  Memories :https://smarturl.it/MemoriesMaroon5Follow : Maroon 5https://www.instagram.com/maroon5https://www.facebook.com/maroon5https://twitter.com/maroon5Background : pexelsMemories Maroon 5 is uploaded here. Memories maroon 5 lyricsbelow :[Chorus]Here's to the ones that we gotCheers to the wish you were here, but you're not'Cause the drinks bring back all the memoriesOf everything we've been throughToast to the ones here todayToast to the ones that we lost on the way'Cause the drinks bring back all the memoriesAnd the memories bring back, memories bring back you[Verse 1]There's a time that I remember, when I did not know no painWhen I believed in forever, and everything would stay the sameNow my heart feel like December when somebody say your name'Cause I can't reach out to call you, but I know I will one day, yeah[Pre-Chorus]Everybody hurts sometimesEverybody hurts someday, ayy-ayyBut everything gon' be alrightGo and raise a glass and say, ayy[Chorus]Here's to the ones that we gotCheers to the wish you were here, but you're not'Cause the drinks bring back all the memoriesOf everything we've been throughToast to the ones here todayToast to the ones that we lost on the way'Cause the drinks bring back all the memoriesAnd the memories bring back, memories bring back you[Post-Chorus]Doo-doo, doo-doo-doo-dooDoo-doo-doo-doo, doo-doo-doo-dooDoo-doo-doo-doo, doo-doo-dooMemories bring back, memories bring back you[Verse 2]There's a time that I remember when I never felt so lostWhen I felt all of the hatred was too powerful to stop (Ooh, yeah)Now my heart feel like an ember and it's lighting up the darkI'll carry these torches for ya that you know I'll never drop, yeah[Pre-Chorus]Everybody hurts sometimesEverybody hurts someday, ayy-ayyBut everything gon' be alrightGo and raise a glass and say, ayyMemories[Chorus]Here's to the ones that we got (Oh-oh)Cheers to the wish you were here, but you're not'Cause the drinks bring back all the memoriesOf everything we've been through (No, no)Toast to the ones here today (Ayy)Toast to the ones that we lost on the way'Cause the drinks bring back all the memories (Ayy)And the memories bring back, memories bring back youMemories maroon 5[Post-Chorus]Doo-doo, doo-doo-doo-dooDoo-doo-doo-doo, doo-doo-doo-dooDoo-doo-doo-doo, doo-doo-dooMemories bring back, memories bring back youDoo-doo, doo-doo-doo-dooDoo-doo-doo-doo, doo-doo-doo-dooDoo-doo-doo-doo, doo-doo-doo (Ooh, yeah)Memories bring back, memories bring back you[Outro]Yeah, yeah, yeahYeah, yeah, yeah, yeah, yeah, no, noMemories bring back, memories bring back you"
XVjNfm_G8m0,"GIVING 1,000 PESOS TO STRANGERS (PRANK NANAMAN?!)  | 12 Days of Christmas Ep.1",PH,2019-12-14T05:58:31.000Z,UCtn6Q5AFzVP-gkrcrp9MwrA,Lloyd Cafe Cadena,24,19.17.12,Lloyd Cafe Cadena|Lloyd Cadena|Pinoy Vlogs|Pinoy Comedy|funny|Stand-up|1000 pesos|prank|giving to strangers|charity|giving back|12 days of christmas,481734,41442,243,9539,https://i.ytimg.com/vi/XVjNfm_G8m0/default.jpg,FALSE,FALSE,"Nagpunta kami ng BAGUIO para magbigay ng 1,000 pesos sa makita naming deserving na makuha ito.SEND ME SOMETHING!!Name: Ely Concord Delos SantosAddress: Unit 303 3/F JTB Bldg., 2165 P. Binay St., Brgy. Bangkal Makati CityGrab a copy of my New Book EX-RATED in All National Book Stores nationwide. Shop online at nationalbookstore.com: http://bit.ly/6LN4AG or call delivery hotline 8888-627.Please don't forget to subscribe to my channel - http://bit.ly/SubscribeLloydPlease Subscribe to my 2nd Channel - https://www.youtube.com/c/lloydcafecadenatv Official Social Media accountsFacebook - https://www.facebook.com/LloydCafeCadenaTwitter - https://twitter.com/LloydCadenaInstagram - http://instagram.com/lloydcafecadena For better quality please watch in HD       Enjoy!"
39L9N_DRU5c,Pang-matalino Raid by Alex Gonzaga,PH,2019-12-14T05:12:04.000Z,UC6N-9Wh0DYhDI8sQS7jwjVA,Alex Gonzaga Official,22,19.17.12,alex gonzaga|alex g|vlog|house raid|vlogger|karen davila|abscbn|may puhunan|reporter|news anchor|karen|korina|tv patrol|bandila|news|duterte|alex vlogs|celebrity house|condo raid|condominium|apartment|high end apartment|makati city|manila|toni gonzaga|mommy pinty|lucky manzano,1186007,45038,804,4867,https://i.ytimg.com/vi/39L9N_DRU5c/default.jpg,FALSE,FALSE,Matatalino na ngayon kinakausap ko... don’t meFor business please contact me!Email: misscathygonzaga@gmail.comFollow me!FB: https://www.facebook.com/MsCathyGonzaga/Twitter: https://twitter.com/MscathygonzagaInstagram: https://www.instagram.com/cathygonzaga/
kwM3oD6frqo,"MAVERICKS at BUCKS | FULL GAME HIGHLIGHTS | December 16, 2019",PH,2019-12-17T03:49:02.000Z,UCWJ2lWNubArHWmf3FIHbfcQ,NBA,17,19.17.12,sp:ty=high|sp:dt=2019-12-17T01:00:00Z|sp:st=basketball|sp:li=nba|sp:ti:home=MIL|sp:ti:away=DAL|Full Game Recap|Full Game Highlights|NBA|Basketball|Pass|Assist|Dunk|Jump Shot|Steal|Rebound|Dallas Mavericks|Milwaukee Bucks,493963,3252,172,1278,https://i.ytimg.com/vi/kwM3oD6frqo/default.jpg,FALSE,FALSE,"MAVERICKS at BUCKS | FULL GAME HIGHLIGHTS | December 16, 2019The Dallas Mavericks defeated the Milwaukee Bucks, 120-116, snapping the Bucks' 18-game winning streak. Kristaps Porzingis recorded 26 PTS and 12 REB for the Mavericks in the victory, while Seth Curry added 26 PTS and 5 REB. Giannis Antetokounmpo tallied a game-high 48 PTS and 14 REB for the Bucks.Catch Tuesday's action on NBA TV: Los Angeles Lakers at Indiana Pacers, 7:00 pm/et & Phoenix Suns at LA Clippers, 10:30 pm/etSubscribe to the NBA: https://on.nba.com/2JX5gSN Full Game Highlights Playlist: https://on.nba.com/2rjGMgeFor news, stories, highlights and more, go to our official website at https://nba_webonly.app.link/nbasiteGet NBA LEAGUE PASS: https://nba.app.link/nbaleaguepass5"
s-flAkDzg2o,"Cassie, iginiit ang kanyang karapatan bilang anak ni Robert | Kadenang Ginto (With Eng Subs)",PH,2019-12-16T13:39:24.000Z,UCstEtN0pgOmCf02EdXsGChw,ABS-CBN Entertainment,24,19.17.12,ABS-CBN|ABS-CBN Online|ABS-CBN Philippines|ABS-CBN Shows|ABS-CBN Teleserye|Kadenang Ginto|Kadenang Ginto Highlights|Kadenang Ginto Episode 309|KG Episode 309|Kadenang Ginto December 16 2019 Episode|#ABSCBNKadenangGinto|#KadenangGinto|#KGPaalam#KadenangGinto #ABSCBNKadenangGinto|Kadenang Ginto Huling Sandali|robert death kadenang ginto|December 16 2019|20191216online|YT0psTiffany|Cassie iginiit ang karapatan|Cassie vs Marga|Cassie nagalit|robert patay na,1090071,9811,608,912,https://i.ytimg.com/vi/s-flAkDzg2o/default.jpg,FALSE,FALSE,"Cassie (Francine Diaz) takes the high road as Daniela (Dimples Romana) insists on forbidding her and Romina (Beauty Gonzalez) to attend Robert's (Albert Martinez) funeral. (With English Subtitles)Subscribe to the ABS-CBN Entertainment channel! - http://bit.ly/ABS-CBNEntertainmentWatch the full episodes of Kadenang Ginto on TFC.TV:http://bit.ly/KadenangGinto-TFCTVand on iWant for Philippine viewers:http://bit.ly/KadenangGinto-iWantVisit our official websites! https://entertainment.abs-cbn.com/tv/shows/kadenangginto/mainhttp://www.push.com.phFacebook: http://www.facebook.com/ABSCBNnetworkTwitter: https://twitter.com/ABSCBN Instagram: http://instagram.com/abscbnEpisode 309 - December 16, 2019 Cast:Dimples Romana (Daniela) / (Roxanne) / Francine Diaz (Cassie, Cassandra) / Adrian Lindayag (Neil) / Beauty Gonzalez (Romina) / Arnold Reyes (Bernard) / Andrea Brillantes (Marga, Margaret)#KGHulingSandali#KadenangGinto#ABSCBNKadenangGinto"
Sbo88CDLgTM,Bronny James leads Sierra Canyon to win in front of LeBron | Prep Highlights,PH,2019-12-15T04:14:08.000Z,UCiWLfSweyRNmLpgEHekhoAg,ESPN,17,19.17.12,LeBron James Jr.|Bronny James|Bronny|Bronny Jr|LeBron James son|bronny james|lebron|lebron james|lebron james bronny|bronny james sierra canyon|sierra canyon|bronny highlights|lebron bronny|bronny james espn|bronny james jr|lebron james jr|lebron espn|bronny espn|lebron lakers|lebron james lakers|bronny james highlights|bronny james high school highlights|bronny sierra canyon|espn|nba|st vincent st marys|prep highlights|sierra canyon highlights,1971702,23186,734,2646,https://i.ytimg.com/vi/Sbo88CDLgTM/default.jpg,FALSE,FALSE,"LeBron James’ son Bronny James scores 15 points, including the game-winning steal and score in the final minute of Sierra Canyon’s win over LeBron’s alma mater St. Vincent-St Mary’s.#Bronny #SierraCanyon✔ Subscribe to ESPN+ https://plus.espn.com/✔ Get the ESPN App: http://www.espn.com/espn/apps/espn✔ Subscribe to ESPN on YouTube: http://es.pn/SUBSCRIBEtoYOUTUBE✔ Subscribe to ESPN FC on YouTube: http://bit.ly/SUBSCRIBEtoESPNFC✔ Subscribe to NBA on ESPN on YouTube: http://bit.ly/SUBSCRIBEtoNBAonESPN✔ Watch ESPN on YouTube TV: http://es.pn/YouTubeTVExclusive interviews with Rachel Nichols https://urlzs.com/jNUReStephen A. Smith on ESPN https://urlzs.com/W19TzESPN on Social Media:► Follow on Twitter: http://www.twitter.com/espn► Like on Facebook: http://www.facebook.com/espn► Follow on Instagram: www.instagram.com/f/espnVisit ESPN on YouTube to get up-to-the-minute sports news coverage, scores, highlights and commentary for NFL, NHL, MLB, NBA, College Football, NCAA Basketball, soccer and more. More on ESPN.com: https://www.espn.com"
OdvnF3cpXAo,PART 2 | MRS NG CANADIAN NABUNTIS NG MGA KAPITBAHAY!,PH,2019-12-16T10:38:40.000Z,UCxhygwqQ1ZMoBGQM2yEcNug,Raffy Tulfo in Action,25,19.17.12,tulfo|raffy tulfo in action|raffy tulfo in action latest|tulfo in action|tulfo in action 2019|raffy tulfo|tulfo in action 2019 latest episode|raffy tulfo in action 2019|raffy tulfo latest|tulfo in action 2019 latest|tulfo 2019|raffy tulfo 2019|raffy tulfo action|tulfo in action latest|raffy tulfo wanted sa radyo latest|tulfo in action latest 2019|wanted sa radyo|raffy tulfo in action latest 2019|tulfo latest,848916,10096,465,6458,https://i.ytimg.com/vi/OdvnF3cpXAo/default.jpg,FALSE,FALSE,"Para sa PART 1, puntahan ang link na ito:https://youtu.be/_3HLL7p0yboYoutube: http://bit.ly/1RaffyTulfoOfficialYoutubeFacebook: http://bit.ly/RaffyTulfoOfficialFacebookInstagram: http://bit.ly/RaffyTulfoOfficialInstagramWebsite: http://bit.ly/RaffyTulfoOfficialWebsitePAALALA: Huwag maniniwala sa ano mang text o tawag na nagpapakilalang staff ng Raffy Tulfo in Action. Ang lahat ng reklamo ay aming hinaharap sa TV5 Media Center lamang (Reliance corner Sheridan Street, Mandaluyong City. Monday-Friday, 9am to 3pm). Ang aming pagtulong ay libre.                                                                                       Huwag po kayong magpost ng inyong comments na gusto ninyong makatulong o magtanong kung paano kayo makatulong sa mga complainant/s na nasa video. Marami na po kaming natatanggap na reklamo tungkol sa mga taong nagbibigay ng maling impormasyon o nagpapanggap na staff ng Raffy Tulfo in Action para makapanloko. Kung nais po ninyong tumulong sa mga taong nasa video, magsadya lamang po kayo o magpadala ng representative sa TV5 Media Center at para personal na iabot sa mismong mga taong gusto ninyong matulungan. Salamat po."
SDH1XARMk5g,Highlights: G2: Ginebra vs NorthPort | PBA Governors’ Cup 2019 Semifinals,PH,2019-12-16T13:44:55.000Z,UCXDG9ue-emCN8Ad3h7lERqQ,ESPN5,17,19.17.12,PBA|PBA 2019|PBA Governors’ Cup 2019|Philippine Basketball Association|PBA Season 44|PBA Replay|TV5|Sports5|ESPN5|Sean Anthony|Paolo Taha|Sol Mercado|Jervy Cruz|Garvo Lanete|Jerramy King|Russel Escoto|Nico Elorde|Christian Standhardinger|Michael Qualls|Justin Brownlee|Greg Slaughter|Japeth Aguilar|Scottie Thompson|LA Tenorio|Stanley Pringle|Art Dela Cruz|Jeff Chan|Semifinals|Barangay Ginebra San Miguel vs NorthPort Batang Pier,621405,3263,379,562,https://i.ytimg.com/vi/SDH1XARMk5g/default.jpg,FALSE,FALSE,"Stanley Pringle had 23 points and Greg Slaughter chipped in 16 points and nine rebounds as Barangay Ginebra got back at NorthPort, 113-88, in Game 2 of the 2019 PBA Governors’ Cup semifinals.Check out more of ESPN5!Website: https://tv5.espn.comFacebook: https://www.facebook.com/Sports5PHTwitter: https://twitter.com/Sports5phInstagram: https://www.instagram.com/sports5.ph"
AJjUxiYCfyM,"MC Einstein - Titig ft. Flow G, Yuri Dope & Jekkpot",PH,2019-12-17T08:00:14.000Z,UCXDPZNH-eEXtrxr5Ert1LWQ,Ex Battalion Music,10,19.17.12,[none],205973,15826,223,1011,https://i.ytimg.com/vi/AJjUxiYCfyM/default.jpg,FALSE,FALSE,"Titig is now available on iTunes, Apple Music and Spotify.Spotify - https://spoti.fi/2ErmGEaiTunes - https://apple.co/2sxeNKEApple Music - https://apple.co/38L1neITitig - Mc Einstein ft. Flow G, Yuri Dope & Jekkpot℗ & © 2019 Ex Battalion Music, a division of Ex Battalion Entertainment.#Titig #Einstein #Exb"
Nc2bbGKvX1Y,Madrasta:  Nang maisahan ng madrasta ang maldita | Episode 51,PH,2019-12-16T11:29:31.000Z,UCKL5hAuzgFQsyrsQKgU0Qng,GMA Network,24,19.17.12,GMA|GMA 7|GMA Network|GMA Teleserye|Madrasta|Madrasta GMA|GMA Madrasta|Madrasta GMA 7|Madrasta Episode 51|Madrasta December 16 2019 full episode|Madrasta December 16 2019|Madrasta December 16|Arra San Agustin|Juancho Trivino|Thea Tolentino|Phytos Ramirez|Manilyn Reynes|Gladys Reyes|Almira Muhlach|Ahron Villena|Divine Aucina|Madrasta Worldwide|Madrasta: Nang maisahan ng madrasta ang maldita | Episode 51,311154,2365,134,108,https://i.ytimg.com/vi/Nc2bbGKvX1Y/default.jpg,FALSE,FALSE,"Aired (December 16, 2019) Nagkakaroon na ng pag-aalinlangan si Sean sa mga sinasabi ni Katharine kaya naman muli niyang pinabalik sa mansyon si Audrey. Saan kaya hahantong ang muling pagsasama ng dalawang Mrs. Ledesma sa iisang bubong?Catch the latest episodes of 'Madrasta' weekdays at 4:15 PM on GMA Afternoon Prime, starring Arra San Agustin as Audrey, Juancho Triviño as Sean, Thea Tolentino as Katharine, and Phytos Ramirez as David. Also in the cast are Manilyn Reynes, Gladys Reyes, Almira Muhlach, Kelvin Miranda, Anjo Damiles, Isabelle de Leon, Ahron Villena, Faye Lorenzo, and Divine Aucina. #MadrastaGMA--------------Subscribe to the GMA Network channel! - http://goo.gl/oYE4DnTo our #KapusoAbroad, you can watch the latest episodes on GMA Pinoy TV! For more information, visit http://www.gmapinoytv.comVisit the GMA Network Portal! http://www.gmanetwork.comConnect with us on:Facebook: http://www.facebook.com/GMANetworkTwitter: https://twitter.com/GMANetworkInstagram: http://instagram.com/GMANetwork"
0Z-a-LLxe_w,"Vloggers na Mag-jowa (Marangalians Merffey Boninay Krissy Achino) Bawal Judgmental December 10, 2019",PH,2019-12-10T10:33:52.000Z,UCi623vUlmMZGgZbVcmzHc7Q,Eat Bulaga!,24,19.17.12,Dabarkads|Eat Bulaga!|Noontime show|Filipino TV Show,1629058,28663,1242,3285,https://i.ytimg.com/vi/0Z-a-LLxe_w/default.jpg,FALSE,FALSE,"SUBSCRIBE to our channel now to get exclusive videos and full episodes of Eat Bulaga! Be with your favourite Dabarkads 24/7! YouTube Channel:  http://bit.ly/1Z4PNPJFOLLOW US! EB on Facebook: https://www.facebook.com/EBdabarkads/timelineEB on Twitter: https://twitter.com/EatBulagaEB on Instagram: https://www.instagram.com/eatbulaga1979/ABOUT EAT BULAGAEat Bulaga! (or EB) is the longest noon-time variety show in the Philippines produced by Television And Production Exponents Inc. (TAPE) and currently aired by GMA Network. The show broadcasts from The New TAPE Studios (Eastside Studio) at the GMA Broadway Centrum in New Manila, Quezon City. Eat Bulaga! is aired Weekdays at 12:00pm to 2:35pm and Saturdays at 11:30am to 2:45pm (PHT).Studio Booking & Reservations: http://bit.ly/1O2IP7H#EatBulaga #Dabarkads"
gkNYlG4e8hY,FlipTop - Sixth Threat vs Poison13 @ Isabuhay 2019 Semi-Finals,PH,2019-12-10T10:04:10.000Z,UCBdHwFIE4AJWSa3Wxdu7bAQ,fliptopbattles,19,19.17.12,fliptop|flip top|flip top battles|fliptopbattles|fliptop battle|fliptop new|fliptop 2019|fliptop recent|fliptop upload|fliptop isabuhay|sixth threat|sixth|threat|poison|poison13|isabuhay|isabuhay 2019|isabuhay semis|fliptop semis|semis|semifinals|new|2019|latest|fliptop latest|recent|upload|battle|rap|underground|hiphop|pinoy|filipino|pinas|philippines|tagalog|bisaya|davao|mindanao|mariveles|bataan|tiu theater|best|jokes|bars|highlights|festival|gloc-9|gloc|gloc 9,2112483,30806,1504,9306,https://i.ytimg.com/vi/gkNYlG4e8hY/default.jpg,FALSE,FALSE,"https://fliptop.com.phFlipTop Metro Manila presents: Bwelta Balentong 6 @ TIU Theater, Mezzanine, Makati Central Square, Makati City, Metro Manila, Philippines. October 12, 2019. Filipino Conference Battle. -SIXTH THREAT VS POISON13-Subscribe Here! http://bit.ly/fliptopsubCheck out our top videos! http://bit.ly/fliptopTopVideosWebsite: https://fliptop.com.phFacebook: https://www.facebook.com/fliptop.battleleagueTwitter: https://twitter.com/FlipTop_Battles#SixthThreat #Poison13 #Isabuhay #Isabuhay2019 #fliptopbattlesAbout fliptopbattles:FlipTop Kru Corp. is a self-produced events and artist management company with its first product in the FlipTop Battle League. The FlipTop Battle League is the Philippines’ first premier – and the world’s most-viewed – rap battle league. It is popularly credited for the resurgence and widespread acceptance of hiphop culture in the Philippines since its inception in February 2010, and continues to champion all other hiphop elements in its variety of events and online content. It is home to the country’s top Hiphop talents and houses divisions in the main island groups of Luzon, Visayas, and Mindanao.www.fliptop.com.phFlipTop - Sixth Threat vs Poison13 @ Isabuhay 2019 Semi-Finalshttps://youtu.be/gkNYlG4e8hY fliptopbattleshttps://www.youtube.com/fliptopbattles"
